{
 "kind": "relation-schema",
 "format": "khg-relation-schema/1.0.0",
 "id": "p6-berge-path",
 "version": "0.1.0",
 "label": "Berge-acyclic: employment and headquarters share only the employer role",
 "entity_types": [
  {
   "id": "Agent"
  },
  {
   "id": "Place"
  }
 ],
 "roles": [
  {
   "id": "employee"
  },
  {
   "id": "employer"
  },
  {
   "id": "city"
  }
 ],
 "relations": [
  {
   "id": "employment",
   "roles": [
    {
     "role": "employee",
     "slot": "core",
     "fillers": [
      {
       "entity": [
        "Agent"
       ]
      }
     ],
     "min": 1,
     "max": 1
    },
    {
     "role": "employer",
     "slot": "core",
     "fillers": [
      {
       "entity": [
        "Agent"
       ]
      }
     ],
     "min": 1,
     "max": 1
    }
   ]
  },
  {
   "id": "headquartered_in",
   "roles": [
    {
     "role": "employer",
     "slot": "core",
     "fillers": [
      {
       "entity": [
        "Agent"
       ]
      }
     ],
     "min": 1,
     "max": 1
    },
    {
     "role": "city",
     "slot": "core",
     "fillers": [
      {
       "entity": [
        "Place"
       ]
      }
     ],
     "min": 1,
     "max": 1
    }
   ]
  }
 ]
}